<?xml version="1.0" encoding="UTF-8"?>

<!-- news -->
<!ELEMENT news (post*)>
<!ELEMENT post (title,description,image)>
<!ELEMENT title (#PCDATA)>
<!ELEMENT description (#PCDATA)>
<!ELEMENT image EMPTY>
<!ATTLIST image src CDATA #REQUIRED>
<!-- news -->