<?xml version="1.0" encoding="UTF-8"?>
<!DOCTYPE news SYSTEM "news.dtd">


<news>
    <post>
        <title>"Harmony in Motion" - A Celebration of Unity Through Dance</title>
        <description>Our participation in the "Harmony in Motion" dance event was a pivotal moment in our artistic journey. The event, aimed at promoting cultural understanding and unity, brought together dancers from diverse backgrounds onto a single stage. Through our choreography, which seamlessly integrated elements of various dance forms, we contributed to the mesmerizing tapestry of movement that represented the beauty of global harmony.
Our performance told a story of collaboration and cooperation, transcending linguistic and cultural barriers. The event provided us with an opportunity to showcase our commitment to cultural fusion, as we gracefully wove together traditional motifs and contemporary expressions. The applause and appreciation from the audience reaffirmed the power of dance as a universal language that can bridge differences and forge connections.</description>
        <image src="news-img-1.jpg" />
    </post>
    <post>
        <title>"Rhythmic Rendezvous" Workshop Series Announced by Harmony in Motion</title>
        <description>Harmony in Motion, renowned for its commitment to promoting cultural understanding through dance, is thrilled to announce its latest initiative, the "Rhythmic Rendezvous" workshop series. This innovative series represents a dynamic exploration of various dance styles, creating a vibrant space for participants of all levels to come together and celebrate the universal language of movement. Through these workshops, Harmony in Motion aims to break down barriers and foster a sense of unity, allowing participants to experience the joy of dance while embracing the richness of different cultural expressions.
The "Rhythmic Rendezvous" series will feature expert instructors guiding participants through a diverse range of dance forms, from traditional cultural dances to contemporary styles. The workshops will emphasize not only technical skills but also the cultural significance and stories behind each dance, providing a holistic understanding of the art. By offering this immersive experience, Harmony in Motion seeks to create a community of dancers who appreciate the beauty of diversity and share a passion for the transformative power of dance. Join us in this exciting journey as we dance our way towards a more interconnected and harmonious world.</description>
        <image src="news-img-2.jpg" />
    </post>
    <post>
        <title>"Harmony in Motion" Unveils New Online Dance Classes for Global Engagement</title>
        <description>In response to the evolving landscape of dance education, Harmony in Motion is proud to introduce a groundbreaking chapter in its teaching approach with the launch of online dance classes. Now, enthusiasts from every corner of the globe can access our world-class instructors and diverse dance curriculum from the convenience of their own homes. Whether you're a novice eager to take your first steps into the world of dance or an experienced practitioner seeking to refine your skills, our online classes provide an interactive and inclusive platform for all.
Harmony in Motion's online dance classes are designed to maintain the high standards of instruction and engagement that our in-person classes are known for. Participants will have the opportunity to connect with instructors and fellow dancers in real-time, fostering a sense of community that transcends geographical boundaries. As we embrace this digital frontier, Harmony in Motion is committed to making the joy of dance accessible to individuals worldwide, ensuring that the transformative power of movement can be experienced by everyone, regardless of location. Join us in this exciting venture as we take the exhilarating world of dance online, inviting participants to share in the magic of movement and connection from anywhere in the world.</description>
        <image src="news-img-3.jpg" />
    </post>
</news>